{
  "id": "OS-business-os-14",
  "title": "T-601: Extend `mission-bootstrap.mjs` to provision a **staging +",
  "description": "- [ ] **T-601**: Extend `mission-bootstrap.mjs` to provision a **staging +\n      production pair** and register both in `portfolio.json` with tiers\n      `scratch` and `internal-production`.\n  - Files: `agents/mission-bootstrap.mjs`\n  - Spec: wireframe-gate/REQ-003\n  - Agent: sdlc-developer\n  - Test: bootstrapped mission has exactly two tiered environments; `--dry-run`\n    prints both and writes nothing; second run neither duplicates the portfolio\n    entry nor re-provisions; existing bootstrap tests pass unmodified\n  - Parallel: blocked-by T-103\n  - Complexity: M",
  "priority": "MEDIUM",
  "status": "pending",
  "agent": "sdlc-developer",
  "estimatedTokens": 3500,
  "source": "openspec/business-os/tasks.md",
  "createdAt": "2026-09-02T18:29:42.807Z",
  "claimedBy": null,
  "testStatus": null,
  "blockedBy": [],
  "tags": [
    "business-os",
    "hermes-handoff",
    "phase-6"
  ]
}
