{
  "id": "OS-business-os-2",
  "title": "T-005: Render readiness on the change card and accept a `ready`",
  "description": "- [ ] **T-005**: Render readiness on the change card and accept a `ready`\n      comment to promote `draft \u2192 ready-for-dev`, mirroring the existing\n      `approve` comment mechanism.\n  - Files: `agents/command-center-sync.mjs`\n  - Spec: work-item-readiness/REQ-004\n  - Agent: sdlc-developer\n  - Test: readiness appears on the parent card; a `ready` comment promotes and\n    survives the next sync; `in-dev`/`ready-for-review` are not settable by\n    comment\n  - Parallel: blocked-by T-004\n  - Complexity: M\n\n### Phase 1: Portfolio foundation",
  "priority": "MEDIUM",
  "status": "blocked",
  "agent": "sdlc-developer",
  "estimatedTokens": 3500,
  "source": "openspec/business-os/tasks.md",
  "createdAt": "2026-09-02T18:29:42.804Z",
  "claimedBy": null,
  "testStatus": null,
  "blockedReason": "modifies command-center-sync.mjs approval handling; pairs with T-004 and carries the same self-modification risk."
}
