{
  "id": "OS-business-os-1",
  "title": "T-004: Advance readiness through the loop \u2014 `ready-for-dev \u2192 in-dev`",
  "description": "- [ ] **T-004**: Advance readiness through the loop \u2014 `ready-for-dev \u2192 in-dev`\n      on first claim, `in-dev \u2192 ready-for-review` on tasks complete with an open\n      PR, `ready-for-review \u2192 done` on merge. Illegal transitions refused;\n      replays are no-ops.\n  - Files: `agents/queue-drainer.mjs`, `agents/pr-auto-review.mjs`\n  - Spec: work-item-readiness/REQ-003\n  - Agent: sdlc-developer\n  - Test: each transition; illegal transition refused and logged; replay is a\n    no-op not an error\n  - Parallel: blocked-by T-003\n  - Complexity: M",
  "priority": "MEDIUM",
  "status": "blocked",
  "agent": "sdlc-developer",
  "estimatedTokens": 3500,
  "source": "openspec/business-os/tasks.md",
  "createdAt": "2026-09-02T18:29:42.803Z",
  "claimedBy": null,
  "testStatus": null,
  "blockedReason": "modifies queue-drainer.mjs and pr-auto-review.mjs \u2014 the machinery executing this very task. Self-modification mid-drain is done interactively, not autonomously."
}
