{
  "id": "OS-business-os-17",
  "title": "T-604: Assert the playbook's pre-existing guardrails survive the",
  "description": "- [ ] **T-604**: Assert the playbook's pre-existing guardrails survive the\n      rewrite \u2014 the 2026-07-27 incident rules (never create scheduler entries,\n      always `pwd` first, never commit `.env.local`, never deploy manually).\n  - Files: `tests/mission-playbook.test.mjs`\n  - Spec: wireframe-gate/REQ-005\n  - Agent: sdlc-developer\n  - Test: each pre-existing guardrail string still present after the rewrite;\n    no orphaned cross-reference from `mission-intake` REQ-003/REQ-006\n  - Parallel: blocked-by T-603\n  - Complexity: S\n  - Notes: Those rules exist because each one already went wrong once.",
  "priority": "MEDIUM",
  "status": "pending",
  "agent": "sdlc-developer",
  "estimatedTokens": 3500,
  "source": "openspec/business-os/tasks.md",
  "createdAt": "2026-09-02T18:29:42.808Z",
  "claimedBy": null,
  "testStatus": null,
  "blockedBy": [
    "OS-business-os-16"
  ],
  "tags": [
    "business-os",
    "hermes-handoff",
    "phase-6"
  ]
}
