{
  "id": "Q-101",
  "phase": 1,
  "title": "capability-monitor dedicated unit tests (BACKLOG #26, carried-forward 7.1/7.2)",
  "description": "agents/capability-monitor.mjs (~16KB) has no dedicated unit tests. Write agents/__tests__/capability-checklist.test.mjs covering: (1) schema validation of capability-checklist entries, (2) config loading, (3) the drift-detection algorithm (required capability with zero log entries for 3+ consecutive tasks fires an alert), (4) scope-creep detection, (5) checklist parsing from mock agent output. Use node:test + assert like the existing tests in agents/__tests__/. Import the module's exported functions directly (it is __isMainModule-guarded). Do NOT change capability-monitor.mjs behavior; if a function is untestable without a tiny refactor, prefer exporting it unchanged. All tests must run in `npm test`.",
  "assignee": "sdlc-developer",
  "priority": "HIGH",
  "estimatedTokens": 18000,
  "files": [
    "agents/__tests__/capability-checklist.test.mjs",
    "agents/capability-monitor.mjs"
  ],
  "blockedBy": [],
  "status": "pending",
  "created": "2026-07-06T13:30:00Z",
  "tags": [
    "quality",
    "tests",
    "backlog-26"
  ]
}
